{
  "status": "done",
  "summary": "Compared the run and resume command construction with `codex exec --help` and `codex exec resume --help`; the passed CLI flags are supported. Found one run-directory collision that can stop a run before Codex starts. The help commands were checked, but the script itself could not be executed because `python.exe` was inaccessible in this environment.",
  "findings": [
    {
      "severity": "medium",
      "location": "codex_delegate.py:172",
      "claim": "Two runs of the same task started within one second produce the same directory name, so the second run fails at `mkdir` with `FileExistsError`.",
      "evidence": "The directory name uses a timestamp with only second precision and the task slug (lines 172\u2013174); `run_dir.mkdir(parents=True)` does not allow an existing directory.",
      "confidence": "high"
    }
  ],
  "questions": [],
  "files_read": [
    "codex_delegate.py",
    "schemas/review.schema.json",
    "schemas/research.schema.json"
  ]
}